{
  "schemaVersion": 1,
  "campaignId": "project-observatory-20260902",
  "title": "Sola Project Observatory",
  "northStar": "Make multi-agent roadmap execution visibly inspectable live and replayable later, in a visible or headless browser, without coupling work to the browser or transferring truth, acceptance, promotion, secret custody, or Repository authority to the view.",
  "sourceRevision": "9e69421531e7d559415b4fa493e39d53eafe7bde",
  "workspaceRoot": "D:\\CodexWorktrees\\product-warehouse-agent-orchestration-20260902",
  "constraints": {
    "forkContext": false,
    "childWorkersAllowed": false,
    "maximumBriefWords": 1500,
    "maximumReturnWords": 300,
    "correctionBudget": 1
  },
  "roadmaps": [
    {
      "id": "OBS-R00",
      "title": "Observatory Constitution and Truth Boundary",
      "outcome": "Freeze observability ownership, event vocabulary, source precedence, authority limits, and the relationship to the completed ORB campaign and drafted ORX extensions.",
      "dependsOn": [],
      "executionMode": "coordinator",
      "taskProfile": {
        "ambiguity": "high",
        "blastRadius": "medium",
        "crossProduct": true,
        "behaviorChange": false,
        "mechanicalAcceptance": true,
        "authorityRequired": false,
        "filesExpected": 6
      },
      "inputs": [
        "_CONTROL/agent-orchestration/README.md",
        "_CONTROL/agent-orchestration/campaigns/orchestrated-roadmap-builder-20260902/ROADMAP-SET.md",
        "_CONTROL/agent-orchestration/campaigns/project-observatory-20260902/ROADMAP-SET.md"
      ],
      "ownedOutputs": [
        "_CONTROL/agent-orchestration/campaigns/project-observatory-20260902/OWNER-TREATY.md",
        "_CONTROL/agent-orchestration/campaigns/project-observatory-20260902/SOURCE-PRECEDENCE.md",
        "_CONTROL/agent-orchestration/campaigns/project-observatory-20260902/SUPERSESSION-LEDGER.md",
        "_CONTROL/agent-orchestration/campaigns/project-observatory-20260902/PROVENANCE-LEDGER.md"
      ],
      "prohibitedPaths": [
        "products/**",
        "R:/Repository-v3/**",
        "**/.env",
        "**/*credential*",
        "**/*private-key*"
      ],
      "acceptance": {
        "mustFire": "A view that grants acceptance, exposes hidden reasoning, or treats Riff as canon is refused.",
        "mustStaySilent": "A source-linked event view reports activity without gaining product or Repository authority.",
        "checks": [
          "Owner treaty names every authority boundary.",
          "The completed ORB campaign remains unchanged."
        ]
      },
      "evidencePolicy": {
        "reuse": [
          "ORB-R00 through ORB-R07 committed qualification evidence",
          "Current provider descriptors, lease state machine, and evidence contracts"
        ],
        "rerunWhen": [
          "The roadmap-owned event, adapter, persistence, service, dashboard, transport, or redaction behavior changes"
        ]
      },
      "target": {
        "host": "Warehouse command plane",
        "root": "D:\\CodexWorktrees\\product-warehouse-agent-orchestration-20260902",
        "portabilityRule": "Collectors run independently of browser visibility; Repository custody remains on Lab at R:\\Repository-v3 and remote access uses authenticated SSH or approved tunnels."
      },
      "phases": [
        {
          "id": "OBS-R00-P01",
          "title": "Freeze north star and operator questions",
          "type": "AFK",
          "mustFire": "An undefined viewer or operator question refuses scope freeze.",
          "mustStaySilent": "The intended watch, inspect, replay, and handoff workflows are explicit."
        },
        {
          "id": "OBS-R00-P02",
          "title": "Declare source precedence",
          "type": "AFK",
          "mustFire": "A dashboard-only claim refuses truth status.",
          "mustStaySilent": "Events link to durable state, Git, checks, or receipts."
        },
        {
          "id": "OBS-R00-P03",
          "title": "Freeze owner and authority treaty",
          "type": "AFK",
          "mustFire": "Any observer able to self-accept or self-promote refuses.",
          "mustStaySilent": "Operator, orchestrator, worker, product, Riff, and Repository roles are bounded."
        },
        {
          "id": "OBS-R00-P04",
          "title": "Define event vocabulary",
          "type": "AFK",
          "mustFire": "Unknown or overloaded event kinds refuse ingestion.",
          "mustStaySilent": "Lifecycle, message, tool, file, check, commit, block, and completion events are distinct."
        },
        {
          "id": "OBS-R00-P05",
          "title": "Separate transcript from hidden reasoning",
          "type": "AFK",
          "mustFire": "A request to capture private chain-of-thought refuses.",
          "mustStaySilent": "Only emitted messages, tool metadata, and durable artifacts are represented."
        },
        {
          "id": "OBS-R00-P06",
          "title": "Freeze campaign provenance",
          "type": "AFK",
          "mustFire": "Missing source revision or gate catalog refuses dispatch.",
          "mustStaySilent": "Twelve roadmaps and seventy-two two-sided phase gates are hashed and readable."
        }
      ]
    },
    {
      "id": "OBS-R01",
      "title": "Canonical Event and Causal Identity ABI",
      "outcome": "Create the provider-neutral event envelope, run identity, causal links, artifact references, clocks, sequence rules, and compatibility contract.",
      "dependsOn": [
        "OBS-R00"
      ],
      "executionMode": "worker",
      "taskProfile": {
        "ambiguity": "medium",
        "blastRadius": "medium",
        "crossProduct": true,
        "behaviorChange": true,
        "mechanicalAcceptance": true,
        "authorityRequired": false,
        "filesExpected": 8
      },
      "inputs": [
        "_CONTROL/agent-orchestration/schemas/orchestration-campaign.schema.json",
        "_CONTROL/agent-orchestration/lib/execution-state.mjs",
        "_CONTROL/agent-orchestration/campaigns/project-observatory-20260902/OWNER-TREATY.md"
      ],
      "ownedOutputs": [
        "_CONTROL/agent-orchestration/schemas/observatory-event.schema.json",
        "_CONTROL/agent-orchestration/schemas/observatory-run.schema.json",
        "_CONTROL/agent-orchestration/lib/observatory/event-identity.mjs",
        "_CONTROL/agent-orchestration/tests/observatory-event.test.mjs"
      ],
      "prohibitedPaths": [
        "products/**",
        "R:/Repository-v3/**",
        "**/.env",
        "**/*credential*",
        "**/*private-key*"
      ],
      "acceptance": {
        "mustFire": "Malformed, duplicate, causally impossible, or secret-shaped events are refused.",
        "mustStaySilent": "Equivalent provider events normalize to stable identities without losing provenance.",
        "checks": [
          "Schema and identity tests pass.",
          "Unknown fields survive versioned compatibility rules or refuse explicitly."
        ]
      },
      "evidencePolicy": {
        "reuse": [
          "ORB-R00 through ORB-R07 committed qualification evidence",
          "Current provider descriptors, lease state machine, and evidence contracts"
        ],
        "rerunWhen": [
          "The roadmap-owned event, adapter, persistence, service, dashboard, transport, or redaction behavior changes"
        ]
      },
      "target": {
        "host": "Warehouse command plane",
        "root": "D:\\CodexWorktrees\\product-warehouse-agent-orchestration-20260902",
        "portabilityRule": "Collectors run independently of browser visibility; Repository custody remains on Lab at R:\\Repository-v3 and remote access uses authenticated SSH or approved tunnels."
      },
      "phases": [
        {
          "id": "OBS-R01-P01",
          "title": "Define run and worker identity",
          "type": "AFK",
          "mustFire": "Missing campaign, roadmap, worker, provider, host, or source identity refuses.",
          "mustStaySilent": "A complete run identity serializes deterministically."
        },
        {
          "id": "OBS-R01-P02",
          "title": "Define canonical event envelope",
          "type": "AFK",
          "mustFire": "Missing kind, clock, sequence, actor, or payload identity refuses.",
          "mustStaySilent": "Valid events round-trip without semantic drift."
        },
        {
          "id": "OBS-R01-P03",
          "title": "Bind causal parentage",
          "type": "AFK",
          "mustFire": "Cycles and impossible parent references refuse.",
          "mustStaySilent": "Message, tool, artifact, check, and lifecycle chains remain traversable."
        },
        {
          "id": "OBS-R01-P04",
          "title": "Bind artifact and Git pointers",
          "type": "AFK",
          "mustFire": "Copied bodies or unverifiable mutable pointers refuse durable status.",
          "mustStaySilent": "Paths, hashes, commits, and Riff pointers remain references."
        },
        {
          "id": "OBS-R01-P05",
          "title": "Version compatibility rules",
          "type": "AFK",
          "mustFire": "A breaking producer version cannot silently ingest.",
          "mustStaySilent": "Compatible prior events migrate deterministically."
        },
        {
          "id": "OBS-R01-P06",
          "title": "Seal event identity fixtures",
          "type": "AFK",
          "mustFire": "Fixture mutation without identity change fails.",
          "mustStaySilent": "Cross-provider equivalent fixtures preserve distinct provenance and stable normalized meaning."
        }
      ]
    },
    {
      "id": "OBS-R02",
      "title": "Codex JSONL Live Adapter",
      "outcome": "Translate Codex CLI JSONL into canonical Observatory events with backpressure, interruption recovery, and no dependency on a visible browser.",
      "dependsOn": [
        "OBS-R01"
      ],
      "executionMode": "worker",
      "taskProfile": {